{
  "schemaVersion": 1,
  "receiptId": "receipt-576ed3afc9820aacf3e7b125",
  "runId": "pc01-244db672-3ce7-4681-b68f-fd6003cce39c",
  "benchmarkId": "PC01",
  "appId": "patchcourt-brand-match",
  "taskFingerprint": "49b3dd5a1edf7a6b2c77e9c49c4f999c34b3e040093203508e1bdffa87a352ef",
  "createdAt": "2026-08-29T17:47:32.227Z",
  "execution": {
    "mode": "offline-demo",
    "criticProvider": "patchcourt:three-role-metric-critics-v1",
    "patchProvider": "patchcourt:prebuilt-reference-candidate-v1",
    "judgeProvider": "patchcourt:paired-outcome-v1",
    "model": null
  },
  "criticProvenance": {
    "entries": [
      {
        "criticId": "deterministic-accessibility-critic-v1",
        "proposedCount": 1,
        "acceptedCount": 1,
        "rejectedCount": 0
      },
      {
        "criticId": "deterministic-decision-evidence-critic-v1",
        "proposedCount": 1,
        "acceptedCount": 1,
        "rejectedCount": 0
      },
      {
        "criticId": "deterministic-privacy-critic-v1",
        "proposedCount": 1,
        "acceptedCount": 1,
        "rejectedCount": 0
      }
    ],
    "acceptedCriticIdsDigest": "8247f87e54c932f9f976c8c4b115f6275875faadaf950235c9ae8a2e9484ac30",
    "digest": "e59a2c56ff1abe95f8912995c084461fe5765df53cc8b3f22aeb6aba60e180d5"
  },
  "target": {
    "origin": "http://127.0.0.1:65338",
    "owned": true,
    "loopbackOnly": true,
    "externalRequestsBlocked": true
  },
  "source": {
    "incumbentSha256": "160a425a3cbce74035a86408c76559cd4653283f7e29a1f84cf34d3abd3ae338",
    "candidateSha256": "6ef55295ca29af27bb02111cca3e5d30c1a57995967396250ac3caeb4196af3a",
    "patchSha256": "e88b51327be3135c234d67496899d7d854c7520831dbc465a17b585374cab9b4",
    "factsSha256": "c1fc28e2027abda3b717cc971f3865d0e6686ea9b82c9b38bcbd099c1787fb90"
  },
  "artifacts": [
    {
      "id": "art-21bea1a37047-desktop-login-screenshot-aa86924342877c9fe0f0cfa41430ddd475eca9258174699f97cce1a07132847a.png",
      "sha256": "aa86924342877c9fe0f0cfa41430ddd475eca9258174699f97cce1a07132847a",
      "uri": "artifact://art-21bea1a37047-desktop-login-screenshot-aa86924342877c9fe0f0cfa41430ddd475eca9258174699f97cce1a07132847a.png",
      "kind": "screenshot",
      "label": "Sign in with the brand demo account · desktop",
      "stepId": "login",
      "variant": "incumbent",
      "capturedAt": "2026-08-29T17:47:33.423Z"
    },
    {
      "id": "art-21bea1a37047-desktop-directory-screenshot-6a22bd50ff3b764ba921ab3dd24ce18143dfd505354a6b2ead6318e8d036fb23.png",
      "sha256": "6a22bd50ff3b764ba921ab3dd24ce18143dfd505354a6b2ead6318e8d036fb23",
      "uri": "artifact://art-21bea1a37047-desktop-directory-screenshot-6a22bd50ff3b764ba921ab3dd24ce18143dfd505354a6b2ead6318e8d036fb23.png",
      "kind": "screenshot",
      "label": "Open Creator Directory · desktop",
      "stepId": "directory",
      "variant": "incumbent",
      "capturedAt": "2026-08-29T17:47:33.509Z"
    },
    {
      "id": "art-21bea1a37047-desktop-search-screenshot-ef7eef1aea932faa0f7ce2606fd81396138049c4bc22ad2897c9eeca71fc435c.png",
      "sha256": "ef7eef1aea932faa0f7ce2606fd81396138049c4bc22ad2897c9eeca71fc435c",
      "uri": "artifact://art-21bea1a37047-desktop-search-screenshot-ef7eef1aea932faa0f7ce2606fd81396138049c4bc22ad2897c9eeca71fc435c.png",
      "kind": "screenshot",
      "label": "Search for US · desktop",
      "stepId": "search",
      "variant": "incumbent",
      "capturedAt": "2026-08-29T17:47:33.624Z"
    },
    {
      "id": "art-21bea1a37047-desktop-profile-screenshot-63c29c49907eee6b97ed868d0227192fe7d895714db41783f0b45582147d7749.png",
      "sha256": "63c29c49907eee6b97ed868d0227192fe7d895714db41783f0b45582147d7749",
      "uri": "artifact://art-21bea1a37047-desktop-profile-screenshot-63c29c49907eee6b97ed868d0227192fe7d895714db41783f0b45582147d7749.png",
      "kind": "screenshot",
      "label": "Open John Smith · desktop",
      "stepId": "profile",
      "variant": "incumbent",
      "capturedAt": "2026-08-29T17:47:33.730Z"
    },
    {
      "id": "art-21bea1a37047-desktop-inspect-screenshot-63c29c49907eee6b97ed868d0227192fe7d895714db41783f0b45582147d7749.png",
      "sha256": "63c29c49907eee6b97ed868d0227192fe7d895714db41783f0b45582147d7749",
      "uri": "artifact://art-21bea1a37047-desktop-inspect-screenshot-63c29c49907eee6b97ed868d0227192fe7d895714db41783f0b45582147d7749.png",
      "kind": "screenshot",
      "label": "Determine audience, verified channel, US-market fit, and next action · desktop",
      "stepId": "inspect",
      "variant": "incumbent",
      "capturedAt": "2026-08-29T17:47:33.803Z"
    },
    {
      "id": "art-21bea1a37047-desktop-offer-screenshot-8e0a11841d5500e241382fb22a30fd55381ab37d6a28d5c715096d1d4153f626.png",
      "sha256": "8e0a11841d5500e241382fb22a30fd55381ab37d6a28d5c715096d1d4153f626",
      "uri": "artifact://art-21bea1a37047-desktop-offer-screenshot-8e0a11841d5500e241382fb22a30fd55381ab37d6a28d5c715096d1d4153f626.png",
      "kind": "screenshot",
      "label": "Change the fee to 1500 and prepare the draft · desktop",
      "stepId": "offer",
      "variant": "incumbent",
      "capturedAt": "2026-08-29T17:47:33.945Z"
    },
    {
      "id": "art-21bea1a37047-desktop-confirm-screenshot-8e0a11841d5500e241382fb22a30fd55381ab37d6a28d5c715096d1d4153f626.png",
      "sha256": "8e0a11841d5500e241382fb22a30fd55381ab37d6a28d5c715096d1d4153f626",
      "uri": "artifact://art-21bea1a37047-desktop-confirm-screenshot-8e0a11841d5500e241382fb22a30fd55381ab37d6a28d5c715096d1d4153f626.png",
      "kind": "screenshot",
      "label": "Confirm the offer remains an unsent draft · desktop",
      "stepId": "confirm",
      "variant": "incumbent",
      "capturedAt": "2026-08-29T17:47:33.989Z"
    },
    {
      "id": "art-21bea1a37047-desktop-confirm-accessibility-bd4679ff0bf3faa0e79ecfe91c1bfc047ac9d648415e07e647f3dc3f757f031d.json",
      "sha256": "bd4679ff0bf3faa0e79ecfe91c1bfc047ac9d648415e07e647f3dc3f757f031d",
      "uri": "artifact://art-21bea1a37047-desktop-confirm-accessibility-bd4679ff0bf3faa0e79ecfe91c1bfc047ac9d648415e07e647f3dc3f757f031d.json",
      "kind": "accessibility",
      "label": "accessibility facts · desktop",
      "stepId": "confirm",
      "variant": "incumbent",
      "capturedAt": "2026-08-29T17:47:33.999Z"
    },
    {
      "id": "art-21bea1a37047-desktop-confirm-console-182c298cfd9d7c896cc07ac87925469927d6e2206931a118f38fc8e50a367a01.json",
      "sha256": "182c298cfd9d7c896cc07ac87925469927d6e2206931a118f38fc8e50a367a01",
      "uri": "artifact://art-21bea1a37047-desktop-confirm-console-182c298cfd9d7c896cc07ac87925469927d6e2206931a118f38fc8e50a367a01.json",
      "kind": "console",
      "label": "console facts · desktop",
      "stepId": "confirm",
      "variant": "incumbent",
      "capturedAt": "2026-08-29T17:47:34.003Z"
    },
    {
      "id": "art-21bea1a37047-desktop-confirm-network-e918cfbd752af2a7d794cd37c51382c4784072a4a702c36ef352b2ec6873d47c.json",
      "sha256": "e918cfbd752af2a7d794cd37c51382c4784072a4a702c36ef352b2ec6873d47c",
      "uri": "artifact://art-21bea1a37047-desktop-confirm-network-e918cfbd752af2a7d794cd37c51382c4784072a4a702c36ef352b2ec6873d47c.json",
      "kind": "network",
      "label": "network facts · desktop",
      "stepId": "confirm",
      "variant": "incumbent",
      "capturedAt": "2026-08-29T17:47:34.007Z"
    },
    {
      "id": "art-21bea1a37047-desktop-confirm-trace-8e31b703f302375742f0e596109617e4156b201381d12ceea93316c3dbe4c221.json",
      "sha256": "8e31b703f302375742f0e596109617e4156b201381d12ceea93316c3dbe4c221",
      "uri": "artifact://art-21bea1a37047-desktop-confirm-trace-8e31b703f302375742f0e596109617e4156b201381d12ceea93316c3dbe4c221.json",
      "kind": "trace",
      "label": "trace facts · desktop",
      "stepId": "confirm",
      "variant": "incumbent",
      "capturedAt": "2026-08-29T17:47:34.011Z"
    },
    {
      "id": "art-21bea1a37047-mobile-login-screenshot-c8f089a99f6fdcd901a4a5fcb2fe8134ab1b8515f6f302ce614f0f9ee8c00e43.png",
      "sha256": "c8f089a99f6fdcd901a4a5fcb2fe8134ab1b8515f6f302ce614f0f9ee8c00e43",
      "uri": "artifact://art-21bea1a37047-mobile-login-screenshot-c8f089a99f6fdcd901a4a5fcb2fe8134ab1b8515f6f302ce614f0f9ee8c00e43.png",
      "kind": "screenshot",
      "label": "Sign in with the brand demo account · mobile",
      "stepId": "login",
      "variant": "incumbent",
      "capturedAt": "2026-08-29T17:47:34.771Z"
    },
    {
      "id": "art-21bea1a37047-mobile-directory-screenshot-3faefaa78ec1b08fe6b791b31ca17e44301e6c426029253e0c9e54ffad6af516.png",
      "sha256": "3faefaa78ec1b08fe6b791b31ca17e44301e6c426029253e0c9e54ffad6af516",
      "uri": "artifact://art-21bea1a37047-mobile-directory-screenshot-3faefaa78ec1b08fe6b791b31ca17e44301e6c426029253e0c9e54ffad6af516.png",
      "kind": "screenshot",
      "label": "Open Creator Directory · mobile",
      "stepId": "directory",
      "variant": "incumbent",
      "capturedAt": "2026-08-29T17:47:34.851Z"
    },
    {
      "id": "art-21bea1a37047-mobile-search-screenshot-ac1ea1d877f7518e1a9d8c6db28396841b1983ce8ef1b9efd9d91c5fb047c850.png",
      "sha256": "ac1ea1d877f7518e1a9d8c6db28396841b1983ce8ef1b9efd9d91c5fb047c850",
      "uri": "artifact://art-21bea1a37047-mobile-search-screenshot-ac1ea1d877f7518e1a9d8c6db28396841b1983ce8ef1b9efd9d91c5fb047c850.png",
      "kind": "screenshot",
      "label": "Search for US · mobile",
      "stepId": "search",
      "variant": "incumbent",
      "capturedAt": "2026-08-29T17:47:34.945Z"
    },
    {
      "id": "art-21bea1a37047-mobile-profile-screenshot-08fc4657811b1dec172b77f4310be5bfd07ab21af5d347f829ff1f1566ca4a67.png",
      "sha256": "08fc4657811b1dec172b77f4310be5bfd07ab21af5d347f829ff1f1566ca4a67",
      "uri": "artifact://art-21bea1a37047-mobile-profile-screenshot-08fc4657811b1dec172b77f4310be5bfd07ab21af5d347f829ff1f1566ca4a67.png",
      "kind": "screenshot",
      "label": "Open John Smith · mobile",
      "stepId": "profile",
      "variant": "incumbent",